Y,RDIV,Invesco Exchange-Traded Fund Trust II Invesco S&P Ultra Dividend Revenue ETF,P, ,Y,100,N,,RDIV,RDIV,N,N
Y,RDN,Radian Group Inc. Common Stock,N, ,N,100,N,,RDN,RDN,N,N
Y,RDNT,"RadNet, Inc. - Common Stock",Q,G,N,100,N,N,,RDNT,N,N
Y,RDOG,ALPS ETF Trust ALPS REIT Dividend Dogs ETF,P, ,Y,100,N,,RDOG,RDOG,N,N
Y,RDS.A,Royal Dutch Shell PLC Royal Dutch Shell American Depositary Shares (Each representing two Class A Ordinary Shares),N, ,N,100,N,,RDS.A,RDS.A,N,N
Y,RDS.B,Royal Dutch Shell PLC Royal Dutch Shell PLC American Depositary Shares (Each representing two Class B Ordinary Shares),N, ,N,100,N,,RDS.B,RDS.B,N,N
Y,RDUS,"Radius Health, Inc. - Common Stock",Q,G,N,100,N,N,,RDUS,N,N
Y,RDVT,"Red Violet, Inc. - Common Stock ",Q,S,N,100,N,N,,RDVT,N,N
Y,RDVY,First Trust Rising Dividend Achievers ETF,Q,G,Y,100,N,N,,RDVY,N,N
Y,RDWR,Radware Ltd. - Ordinary Shares,Q,Q,N,100,N,N,,RDWR,N,N
Y,RDY,Dr. Reddy's Laboratories Ltd Common Stock,N, ,N,100,N,,RDY,RDY,N,N
Y,RE,"Everest Re Group, Ltd. Common Stock",N, ,N,100,N,,RE,RE,N,Y
Y,REAL,"The RealReal, Inc. - Common Stock",Q,Q,N,100,N,D,,REAL,N,N
Y,REC,Emles Real Estate Credit ETF,Z, ,Y,100,N,,REC,REC,N,N
Y,RECS,Columbia Research Enhanced Core ETF,P, ,Y,100,N,,RECS,RECS,N,N
Y,REDU,RISE Education Cayman Ltd - American Depositary Shares,Q,G,N,100,N,N,,REDU,N,N
Y,REED,"Reeds, Inc. - Common Stock",Q,S,N,100,N,N,,REED,N,N
Y,REET,iShares Trust iShares Global REIT ETF,P, ,Y,100,N,,REET,REET,N,N
Y,REFR,Research Frontiers Incorporated - Common Stock,Q,S,N,100,N,N,,REFR,N,N
Y,REG,Regency Centers Corporation - Common Stock,Q,Q,N,100,N,N,,REG,N,Y
Y,REGI,"Renewable Energy Group, Inc. - Common Stock",Q,Q,N,100,N,N,,REGI,N,N
Y,REGL,ProShares S&P MidCap 400 Dividend Aristocrats ETF,Z, ,Y,100,N,,REGL,REGL,N,N
Y,REGN,"Regeneron Pharmaceuticals, Inc. - Common Stock",Q,Q,N,100,N,N,,REGN,N,Y
Y,REI,"Ring Energy, Inc. Common Stock",A, ,N,100,N,,REI,REI,N,N
Y,REK,ProShares Short Real Estate,P, ,Y,100,N,,REK,REK,N,N
Y,REKR,"Rekor Systems, Inc. - Common Stock",Q,S,N,100,N,N,,REKR,N,N
Y,RELL,"Richardson Electronics, Ltd. - Common Stock",Q,Q,N,100,N,N,,RELL,N,N
Y,RELV,"Reliv' International, Inc. - Common Stock",Q,S,N,100,N,N,,RELV,N,N
Y,RELX,RELX PLC PLC American Depositary Shares (Each representing One Ordinary Share),N, ,N,100,N,,RELX,RELX,N,N
Y,REM,iShares Trust iShares Mortgage Real Estate ETF,Z, ,Y,100,N,,REM,REM,N,N
Y,REML,"Credit Suisse AG Credit Suisse X-Links Monthly Pay 2xLeveraged Mortgage REIT Exchange Traded Notes (ETNs) due July 11, 2036",P, ,N,100,N,,REML,REML,N,N
Y,REMX,VanEck Vectors Rare Earth Strategic Metals ETF,P, ,Y,100,N,,REMX,REMX,N,N
Y,RENN,"Renren Inc. American Depositary Shares, each representing fifteen Class A ordinary shares",N, ,N,100,N,,RENN,RENN,N,N
Y,REPH,"Recro Pharma, Inc. - Common Stock",Q,S,N,100,N,N,,REPH,N,N
Y,REPL,"Replimune Group, Inc. - Common Stock",Q,Q,N,100,N,N,,REPL,N,N
Y,RES,"RPC, Inc. Common Stock",N, ,N,100,N,,RES,RES,N,N
Y,RESD,WisdomTree International ESG Fund,Z, ,Y,100,N,,RESD,RESD,N,N
Y,RESE,WisdomTree Emerging Markets ESG Fund,Z, ,Y,100,N,,RESE,RESE,N,N
Y,RESI,Front Yard Residential Corporation Common Stock,N, ,N,100,N,,RESI,RESI,N,N
Y,RESN,Resonant Inc. - Common Stock,Q,S,N,100,N,N,,RESN,N,N
Y,RESP,WisdomTree U.S. ESG Fund,P, ,Y,100,N,,RESP,RESP,N,N
Y,RETA,"Reata Pharmaceuticals, Inc. - Class A Common Stock",Q,G,N,100,N,N,,RETA,N,N
Y,RETL,Direxion Daily Retail Bull 3X Shares ETF,P, ,Y,100,N,,RETL,RETL,N,N
Y,RETO,"ReTo Eco-Solutions, Inc. - Common Shares",Q,S,N,100,N,H,,RETO,N,N
Y,REV,"Revlon, Inc. New Common Stock",N, ,N,100,N,,REV,REV,N,N
Y,REVG,"REV Group, Inc. Common Stock",N, ,N,100,N,,REVG,REVG,N,N
Y,REVS,Columbia Research Enhanced Value ETF,P, ,Y,100,N,,REVS,REVS,N,N
Y,REW,ProShares UltraShort Technology,P, ,Y,100,N,,REW,REW,N,N
Y,REX,REX American Resources Corporation,N, ,N,100,N,,REX,REX,N,N
Y,REXN,"Rexahn Pharmaceuticals, Inc. - Common Stock",Q,S,N,100,N,N,,REXN,N,N
Y,REXR,"Rexford Industrial Realty, Inc. Common Stock",N, ,N,100,N,,REXR,REXR,N,N
Y,REXR$A,"Rexford Industrial Realty, Inc. 5.875% Series A Cumulative Redeemable Preferred Stock",N, ,N,100,N,,REXRpA,REXR-A,N,N
Y,REXR$B,"Rexford Industrial Realty, Inc. 5.875% Series B Cumulative Redeemable Preferred Stock",N, ,N,100,N,,REXRpB,REXR-B,N,N
Y,REXR$C,"Rexford Industrial Realty, Inc. 5.625% Series C Cumulative Redeemable Preferred Stock, par value $0.01 per share",N, ,N,100,N,,REXRpC,REXR-C,N,N
Y,REYN,Reynolds Consumer Products Inc. - Common Stock,Q,Q,N,100,N,N,,REYN,N,N
Y,REZ,iShares Residential and Multisector Real Estate ETF,P, ,Y,100,N,,REZ,REZ,N,N
Y,REZI,"Resideo Technologies, Inc. Common Stock ",N, ,N,100,N,,REZI,REZI,N,N
Y,RF,Regions Financial Corporation Common Stock,N, ,N,100,N,,RF,RF,N,Y
Y,RF$A,Regions Financial Corporation Depositary Shares Representing 1/40th Perpetual Preferred Series A,N, ,N,100,N,,RFpA,RF-A,N,N
Y,RF$B,Regions Financial Corporation Depositary Shares Representing 1/40th Perpetual Preferred Series B,N, ,N,100,N,,RFpB,RF-B,N,N
Y,RF$C,"Regions Financial Corporation Depositary Shares, each Representing a 1/40th Interest in a  Share of 5.700% Fixed-to-Floating Rate Non-Cumulative  Perpetual Preferred Stock, Series C",N, ,N,100,N,,RFpC,RF-C,N,N
Y,RFAP,First Trust RiverFront Dynamic Asia Pacific ETF,Q,G,Y,100,N,N,,RFAP,N,N
Y,RFCI,RiverFront Dynamic Core Income ETF,P, ,Y,100,N,,RFCI,RFCI,N,N
Y,RFDA,RiverFront Dynamic US Dividend Advantage ETF,P, ,Y,100,N,,RFDA,RFDA,N,N
Y,RFDI,First Trust RiverFront Dynamic Developed International ETF,Q,G,Y,100,N,N,,RFDI,N,N
Y,RFEM,First Trust RiverFront Dynamic Emerging Markets ETF,Q,G,Y,100,N,N,,RFEM,N,N
Y,RFEU,First Trust RiverFront Dynamic Europe ETF,Q,G,Y,100,N,N,,RFEU,N,N
Y,RFFC,RiverFront Dynamic US Flex-Cap ETF,P, ,Y,100,N,,RFFC,RFFC,N,N
Y,RFG,Invesco S&P Midcap 400 Pure Growth ETF,P, ,Y,100,N,,RFG,RFG,N,N
Y,RFI,"Cohen & Steers Total Return Realty Fund, Inc. Common Stock",N, ,N,100,N,,RFI,RFI,N,N
Y,RFIL,"RF Industries, Ltd. - Common Stock",Q,G,N,100,N,N,,RFIL,N,N
Y,RFL,"Rafael Holdings, Inc. Class B Common Stock",N, ,N,100,N,,RFL,RFL,N,N
Y,RFM,"RiverNorth Flexible Municipal Income Fund, Inc. Common Stock",N, ,N,100,N,,RFM,RFM,N,N
Y,RFP,Resolute Forest Products Inc. Common Stock,N, ,N,100,N,,RFP,RFP,N,N
Y,RFUN,RiverFront Dynamic Unconstrained Income ETF,P, ,Y,100,N,,RFUN,RFUN,N,N
Y,RFV,Invesco S&P Midcap 400 Pure Value ETF,P, ,Y,100,N,,RFV,RFV,N,N
Y,RGA,"Reinsurance Group of America, Incorporated Common Stock",N, ,N,100,N,,RGA,RGA,N,N
Y,RGCO,RGC Resources Inc. - Common Stock,Q,G,N,100,N,N,,RGCO,N,N
Y,RGEN,Repligen Corporation - Common Stock,Q,Q,N,100,N,N,,RGEN,N,N
Y,RGI,Invesco S&P 500 Equal Weight Industrials Portfolio,P, ,Y,100,N,,RGI,RGI,N,N
Y,RGLD,"Royal Gold, Inc. - Common Stock",Q,Q,N,100,N,N,,RGLD,N,N
Y,RGLS,Regulus Therapeutics Inc. - Common Stock,Q,S,N,100,N,D,,RGLS,N,N
Y,RGNX,REGENXBIO Inc. - Common Stock,Q,Q,N,100,N,N,,RGNX,N,N
Y,RGP,"Resources Connection, Inc. - Common Stock",Q,Q,N,100,N,N,,RGP,N,N
Y,RGR,"Sturm, Ruger & Company, Inc. Common Stock",N, ,N,100,N,,RGR,RGR,N,N
Y,RGS,Regis Corporation Common Stock,N, ,N,100,N,,RGS,RGS,N,N
Y,RGT,"Royce Global Value Trust, Inc. Common Stock",N, ,N,100,N,,RGT,RGT,N,N
Y,RH,RH Common Stock,N, ,N,100,N,,RH,RH,N,N
Y,RHE,"Regional Health Properties, Inc. Common Stock",A, ,N,100,N,,RHE,RHE,N,N
Y,RHE$A,"Regional Health Properties, Inc. 10.875% Series A Cumulative Redeemable Preferred Stock",A, ,N,100,N,,RHEpA,RHE-A,N,N
Y,RHI,Robert Half International Inc. Common Stock,N, ,N,100,N,,RHI,RHI,N,Y
Y,RHP,"Ryman Hospitality Properties, Inc. (REIT)",N, ,N,100,N,,RHP,RHP,N,N
Y,RHS,Invesco S&P 500 Equal Weight Consumer Staples ETF  ,P, ,Y,100,N,,RHS,RHS,N,N
Y,RIBT,RiceBran Technologies - Common Stock,Q,S,N,100,N,D,,RIBT,N,N
Y,RICK,"RCI Hospitality Holdings, Inc. - Common Stock",Q,G,N,100,N,N,,RICK,N,N
Y,RIG,Transocean Ltd (Switzerland) Common Stock,N, ,N,100,N,,RIG,RIG,N,N
Y,RIGL,"Rigel Pharmaceuticals, Inc. - Common Stock",Q,Q,N,100,N,N,,RIGL,N,N
Y,RIGS,RiverFront Strategic Income Fund,P, ,Y,100,N,,RIGS,RIGS,N,N
Y,RILY,"B. Riley Financial, Inc. - Common Stock",Q,G,N,100,N,N,,RILY,N,N
Y,RILYG,"B. Riley Financial, Inc. - 7.25% Senior Notes due 2027",Q,G,N,100,N,N,,RILYG,N,N
Y,RILYH,"B. Riley Financial, Inc. - 7.375% Senior Notes Due 2023",Q,G,N,100,N,N,,RILYH,N,N
Y,RILYI,"B. Riley Financial, Inc. - 6.875% Senior Notes due 2023",Q,G,N,100,N,N,,RILYI,N,N
Y,RILYL,"B. Riley Financial, Inc. - Depositary Shares, each representing a 1/1000th fractional interest in a share of Series B Cumulative Perpetual Preferred Stock",Q,G,N,100,N,N,,RILYL,N,N
Y,RILYM,"B. Riley Financial, Inc. - 6.375% Senior Notes due 2025",Q,G,N,100,N,N,,RILYM,N,N
Y,RILYN,"B. Riley Financial, Inc. - 6.50% Senior Notes Due 2026",Q,G,N,100,N,N,,RILYN,N,N
Y,RILYO,"B. Riley Financial, Inc. - 6.75% Senior Notes due 2024",Q,G,N,100,N,N,,RILYO,N,N
Y,RILYP,"B. Riley Financial, Inc. - Depositary Shares, each representing a 1/1000th fractional interest in a share of Series A Cumulative Perpetual Preferred Stock",Q,G,N,100,N,N,,RILYP,N,N
Y,RILYZ,"B. Riley Financial, Inc. - 7.50% Senior Notes Due 2027",Q,G,N,100,N,N,,RILYZ,N,N
Y,RINF,ProShares Inflation Expectations ETF,P, ,Y,100,N,,RINF,RINF,N,N
Y,RING,iShares MSCI Global Gold Miners ETF,Q,G,Y,100,N,N,,RING,N,N
Y,RIO,Rio Tinto Plc Common Stock,N, ,N,100,N,,RIO,RIO,N,N
Y,RIOT,"Riot Blockchain, Inc - Common Stock",Q,S,N,100,N,N,,RIOT,N,N
Y,RISE,Sit Rising Rate ETF,P, ,Y,100,N,,RISE,RISE,N,N
Y,RISN,Inspire Tactical Balanced ESG ETF,P, ,Y,100,N,,RISN,RISN,N,N
Y,RIV,"RiverNorth Opportunities Fund, Inc. Common Stock",N, ,N,100,N,,RIV,RIV,N,N
Y,RIV.R,"RiverNorth Opportunities Fund, Inc. Rights (expiring November 3, 2020)",N, ,N,100,N,,RIVr,RIV^,N,N
Y,RIVE,Riverview Financial Corporation - Common Stock,Q,G,N,100,N,N,,RIVE,N,N
Y,RJA,AB Svensk Ekportkredit (Swedish Export Credit Corporation) ELEMENTS Linked to the Rogers International Commodity Index - Agriculture Total Return Structured Product,P, ,N,100,N,,RJA,RJA,N,N
Y,RJF,"Raymond James Financial, Inc. Common Stock",N, ,N,100,N,,RJF,RJF,N,Y
Y,RJI,AB Svensk Ekportkredit (Swedish Export Credit Corporation) ELEMENTS Linked to the Rogers International Commodity Index - Total Return Structured Product,P, ,N,100,N,,RJI,RJI,N,N
Y,RJN,AB Svensk Ekportkredit (Swedish Export Credit Corporation) ELEMENTS Linked to the Rogers International Commodity Index - Energy Total Return Structured Product,P, ,N,100,N,,RJN,RJN,N,N
Y,RJZ,AB Svensk Ekportkredit (Swedish Export Credit Corporation) ELEMENTS Linked to the Rogers International Commodity Index - Metals Total Return Structured Product,P, ,N,100,N,,RJZ,RJZ,N,N
Y,RKDA,"Arcadia Biosciences, Inc. - Common Stock",Q,S,N,100,N,N,,RKDA,N,N
Y,RKT,"Rocket Companies, Inc. Class A Common Stock",N, ,N,100,N,,RKT,RKT,N,N
Y,RL,Ralph Lauren Corporation Common Stock,N, ,N,100,N,,RL,RL,N,Y
Y,RLAY,"Relay Therapeutics, Inc. - Common Stock",Q,G,N,100,N,N,,RLAY,N,N
Y,RLGT,"Radiant Logistics, Inc. Common Stock",A, ,N,100,N,,RLGT,RLGT,N,N
Y,RLGY,Realogy Holdings Corp. Common Stock,N, ,N,100,N,,RLGY,RLGY,N,N
Y,RLH,Red Lions Hotels Corporation Common Stock,N, ,N,100,N,,RLH,RLH,N,N
Y,RLI,RLI Corp. Common Stock (DE),N, ,N,100,N,,RLI,RLI,N,N
Y,RLJ,RLJ Lodging Trust Common Shares of Beneficial Interest $0.01 par value,N, ,N,100,N,,RLJ,RLJ,N,N
Y,RLJ$A,RLJ Lodging Trust $1.95 Series A Cumulative Convertible  Preferred Shares,N, ,N,100,N,,RLJpA,RLJ-A,N,N
Y,RLMD,"Relmada Therapeutics, Inc. - Common Stock",Q,Q,N,100,N,N,,RLMD,N,N
Y,RLY,SPDR SSgA Multi Asset Real Return ETF,P, ,Y,100,N,,RLY,RLY,N,N
Y,RM,Regional Management Corp. Common Stock,N, ,N,100,N,,RM,RM,N,N
Y,RMAX,"RE/MAX Holdings, Inc. Class A Common Stock",N, ,N,100,N,,RMAX,RMAX,N,N
Y,RMBI,"Richmond Mutual Bancorporation, Inc. - Common Stock",Q,S,N,100,N,N,,RMBI,N,N
Y,RMBL,"RumbleOn, Inc. - Class B Common Stock",Q,S,N,100,N,N,,RMBL,N,N
Y,RMBS,"Rambus, Inc. - Common Stock",Q,Q,N,100,N,N,,RMBS,N,N
Y,RMCF,"Rocky Mountain Chocolate Factory, Inc. - Common Stock",Q,G,N,100,N,N,,RMCF,N,N
Y,RMD,ResMed Inc. Common Stock,N, ,N,100,N,,RMD,RMD,N,Y
Y,RMED,"Ra Medical Systems, Inc. Common Stock",N, ,N,100,N,,RMED,RMED,N,N
Y,RMG,RMG Acquisition Corp. Class A Common Stock,N, ,N,100,N,,RMG,RMG,N,N
Y,RMG.U,RMG Acquisition Corp. Unit,N, ,N,100,N,,RMG.U,RMG=,N,N
Y,RMG.W,"RMG Acquisition Corp. Warrants, each whole warrant exercisable for one share of Class A Common Stock at an exercise price of $11.50",N, ,N,100,N,,RMG.WS,RMG+,N,N
Y,RMI,"RiverNorth Opportunistic Municipal Income Fund, Inc. Common Stock",N, ,N,100,N,,RMI,RMI,N,N
Y,RMM,"RiverNorth Managed Duration Municipal Income Fund, Inc. Common Stock",N, ,N,100,N,,RMM,RMM,N,N
Y,RMNI,"Rimini Street, Inc. - Common Stock",Q,G,N,100,N,N,,RMNI,N,N
Y,RMPL$,RiverNorth Specialty Finance Corporation 5.875% ,N, ,N,100,N,,RMPLp,RMPL-,N,N
Y,RMR,The RMR Group Inc. - Class A Common Stock,Q,S,N,100,N,N,,RMR,N,N
Y,RMRM,RMR Mortgage Trust - Common Stock,Q,S,N,100,N,N,,RMRM,N,N
Y,RMT,"Royce Micro-Cap Trust, Inc. Common Stock",N, ,N,100,N,,RMT,RMT,N,N
Y,RMTI,"Rockwell Medical, Inc. - Common Stock",Q,G,N,100,N,N,,RMTI,N,N
Y,RNA,"Avidity Biosciences, Inc. - Common Stock",Q,G,N,100,N,N,,RNA,N,N
Y,RNDB,"Randolph Bancorp, Inc. - Common Stock",Q,G,N,100,N,N,,RNDB,N,N
Y,RNDM,First Trust Developed International Equity Select ETF,Q,G,Y,100,N,N,,RNDM,N,N
Y,RNDV,First Trust US Equity Dividend Select ETF,Q,G,Y,100,N,N,,RNDV,N,N
Y,RNEM,First Trust Emerging Markets Equity Select ETF,Q,G,Y,100,N,N,,RNEM,N,N
Y,RNET,"RigNet, Inc. - Common Stock",Q,Q,N,100,N,N,,RNET,N,N
Y,RNG,"RingCentral, Inc. Class A Common Stock",N, ,N,100,N,,RNG,RNG,N,N
Y,RNGR,"Ranger Energy Services, Inc. Class A Common Stock",N, ,N,100,N,,RNGR,RNGR,N,N
Y,RNLC,First Trust Large Cap US Equity Select ETF,Q,G,Y,100,N,N,,RNLC,N,N
Y,RNLX,Renalytix AI plc - American Depositary Shares,Q,G,N,100,N,N,,RNLX,N,N
Y,RNMC,First Trust Mid Cap US Equity Select ETF,Q,G,Y,100,N,N,,RNMC,N,N
Y,RNP,"Cohen & Steers REIT and Preferred and Income Fund, Inc. Common Shares",N, ,N,100,N,,RNP,RNP,N,N
Y,RNR,RenaissanceRe Holdings Ltd. Common Stock,N, ,N,100,N,,RNR,RNR,N,N
Y,RNR$E,RenaissanceRe Holdings Ltd. 5.375% Series E Preference Shares,N, ,N,100,N,,RNRpE,RNR-E,N,N
Y,RNR$F,"RenaissanceRe Holdings Ltd. Depositary Shares, each Representing a 1/1,000th Interest in a 5.750% Series F Preference Share",N, ,N,100,N,,RNRpF,RNR-F,N,N
Y,RNSC,First Trust Small Cap US Equity Select ETF,Q,G,Y,100,N,N,,RNSC,N,N
Y,RNST,Renasant Corporation - Common Stock,Q,Q,N,100,N,N,,RNST,N,N
Y,RNWK,"RealNetworks, Inc. - Common Stock",Q,Q,N,100,N,N,,RNWK,N,N
Y,ROAD,"Construction Partners, Inc. - Common Stock",Q,Q,N,100,N,N,,ROAD,N,N
Y,ROAM,Hartford Multifactor Emerging Markets ETF,P, ,Y,100,N,,ROAM,ROAM,N,N
Y,ROBO,Exchange Traded Concepts Trust ROBO Global Robotics and Automation Index ETF,P, ,Y,100,N,,ROBO,ROBO,N,N
Y,ROBT,First Trust Nasdaq Artificial Intelligence and Robotics ETF,Q,G,Y,100,N,N,,ROBT,N,N
Y,ROCH,Roth CH Acquisition I Co. - Common Stock,Q,S,N,100,N,N,,ROCH,N,N
Y,ROCHU,Roth CH Acquisition I Co. - Unit,Q,S,N,100,N,N,,ROCHU,N,N
Y,ROCHW,Roth CH Acquisition I Co. - Warrant,Q,S,N,100,N,N,,ROCHW,N,N
Y,ROCK,"Gibraltar Industries, Inc. - Common Stock",Q,Q,N,100,N,N,,ROCK,N,N
Y,RODE,Hartford Multifactor Diversified International ETF,Z, ,Y,100,N,,RODE,RODE,N,N
Y,RODI,iPath Return on Disability ETN,Z, ,N,100,N,,RODI,RODI,N,N
Y,RODM,Hartford Multifactor Developed Markets (ex-US) ETF,P, ,Y,100,N,,RODM,RODM,N,N
Y,ROG,Rogers Corporation Common Stock,N, ,N,100,N,,ROG,ROG,N,N
Y,ROIC,Retail Opportunity Investments Corp. - Common Stock,Q,Q,N,100,N,N,,ROIC,N,N
Y,ROK,"Rockwell Automation, Inc. Common Stock",N, ,N,100,N,,ROK,ROK,N,Y
Y,ROKT,SPDR S&P Kensho Final Frontiers ETF,P, ,Y,100,N,,ROKT,ROKT,N,N
Y,ROKU,"Roku, Inc. - Class A Common Stock",Q,Q,N,100,N,N,,ROKU,N,N
Y,ROL,"Rollins, Inc. Common Stock",N, ,N,100,N,,ROL,ROL,N,Y
Y,ROLL,RBC Bearings Incorporated - Common Stock,Q,Q,N,100,N,N,,ROLL,N,N
Y,ROM,ProShares Ultra Technology,P, ,Y,100,N,,ROM,ROM,N,N
Y,ROMO,Strategy Shares Newfound/ReSolve Robust Momentum ETF,Z, ,Y,100,N,,ROMO,ROMO,N,N
Y,ROOF,IQ US Real Estate Small Cap ETF,P, ,Y,100,N,,ROOF,ROOF,N,N
Y,ROP,"Roper Technologies, Inc. Common Stock",N, ,N,100,N,,ROP,ROP,N,Y
Y,ROSC,Hartford Multifactor Small Cap ETF,P, ,Y,100,N,,ROSC,ROSC,N,N
Y,ROST,"Ross Stores, Inc. - Common Stock",Q,Q,N,100,N,N,,ROST,N,Y
Y,ROUS,Hartford Multifactor U.S. Equity ETF,P, ,Y,100,N,,ROUS,ROUS,N,N
Y,RP,"RealPage, Inc. - Common Stock",Q,Q,N,100,N,N,,RP,N,N
Y,RPAI,"Retail Properties of America, Inc. Class A Common Stock",N, ,N,100,N,,RPAI,RPAI,N,N
Y,RPAR,RPAR Risk Parity ETF,P, ,Y,100,N,,RPAR,RPAR,N,N
Y,RPAY,Repay Holdings Corporation - Class A Common Stock,Q,S,N,100,N,N,,RPAY,N,N
Y,RPD,"Rapid7, Inc. - Common Stock",Q,G,N,100,N,N,,RPD,N,N
Y,RPG,Invesco S&P 500 Pure Growth ETF,P, ,Y,100,N,,RPG,RPG,N,N
Y,RPLA,Replay Acquisition Corp. Ordinary Shares,N, ,N,100,N,,RPLA,RPLA,N,N
Y,RPLA.U,"Replay Acquisition Corp. Units, each consisting of one Ordinary Share and one-half of one Warrant",N, ,N,100,N,,RPLA.U,RPLA=,N,N
Y,RPLA.W,"Replay Acquisition Corp. Warrants, each whole warrant exercisable for one Ordinary Share at an exercise price of $11.50",N, ,N,100,N,,RPLA.WS,RPLA+,N,N
Y,RPM,RPM International Inc. Common Stock,N, ,N,100,N,,RPM,RPM,N,N
Y,RPRX,Royalty Pharma plc - Class A Ordinary Shares,Q,Q,N,100,N,N,,RPRX,N,N
Y,RPT,RPT Realty Common Stock,N, ,N,100,N,,RPT,RPT,N,N
Y,RPT$D,RPT Realty 7.25% ,N, ,N,100,N,,RPTpD,RPT-D,N,N
Y,RPTX,Repare Therapeutics Inc. - Common Shares,Q,Q,N,100,N,N,,RPTX,N,N
Y,RPV,Invesco S&P 500 Pure Value ETF,P, ,Y,100,N,,RPV,RPV,N,N
Y,RQI,Cohen & Steers Quality Income Realty Fund Inc Common Shares,N, ,N,100,N,,RQI,RQI,N,N
Y,RRBI,"Red River Bancshares, Inc. - Common Stock",Q,Q,N,100,N,N,,RRBI,N,N
Y,RRC,Range Resources Corporation Common Stock,N, ,N,100,N,,RRC,RRC,N,N
Y,RRD,R.R. Donnelley & Sons Company Common Stock,N, ,N,100,N,,RRD,RRD,N,N
Y,RRGB,"Red Robin Gourmet Burgers, Inc. - Common Stock",Q,Q,N,100,N,N,,RRGB,N,N
Y,RRR,"Red Rock Resorts, Inc. - Class A Common Stock",Q,Q,N,100,N,N,,RRR,N,N
Y,RS,Reliance Steel & Aluminum Co. Common Stock (DE),N, ,N,100,N,,RS,RS,N,N
Y,RSF,RiverNorth Specialty Finance Corporation,N, ,N,100,N,,RSF,RSF,N,N
Y,RSG,"Republic Services, Inc. Common Stock",N, ,N,100,N,,RSG,RSG,N,Y
Y,RSP,Invesco S&P 500 Equal Weight ETF,P, ,Y,100,N,,RSP,RSP,N,N
Y,RSSS,"Research Solutions, Inc - Common Stock",Q,S,N,100,N,N,,RSSS,N,N
Y,RSX,VanEck Vectors Russia ETF,Z, ,Y,100,N,,RSX,RSX,N,N
Y,RSXJ,VanEck Vectors Russia Small-Cap ETF,Z, ,Y,100,N,,RSXJ,RSXJ,N,N
Y,RTH,VanEck Vectors Retail ETF,Q,G,Y,100,N,N,,RTH,N,N
Y,RTLR,Rattler Midstream LP - Common Units Representing Limited Partnership Interests,Q,Q,N,100,N,N,,RTLR,N,N
Y,RTM,Invesco S&P 500 Equal Weight Materials ETF,P, ,Y,100,N,,RTM,RTM,N,N
Y,RTP.U,"Reinvent Technology Partners Units, each consisting of one Class A ordinary share and one-fourth of one redeemable warrant",N, ,N,100,N,,RTP.U,RTP=,N,N
Y,RTRX,"Retrophin, Inc. - Common Stock",Q,G,N,100,N,N,,RTRX,N,N
Y,RTX,Raytheon Technologies Corporation Common Stock,N, ,N,100,N,,RTX,RTX,N,Y
Y,RUBY,"Rubius Therapeutics, Inc. - Common Stock",Q,Q,N,100,N,N,,RUBY,N,N
Y,RUHN,Ruhnn Holding Limited - American Depositary Shares,Q,Q,N,100,N,N,,RUHN,N,N
Y,RUN,Sunrun Inc. - Common Stock,Q,Q,N,100,N,N,,RUN,N,N
Y,RUSHA,"Rush Enterprises, Inc. - Class A Common Stock",Q,Q,N,100,N,N,,RUSHA,N,N
Y,RUSHB,"Rush Enterprises, Inc. - Class B Common Stock",Q,Q,N,100,N,N,,RUSHB,N,N
Y,RUSL,Direxion Daily Russia Bull 2X Shares,P, ,Y,100,N,,RUSL,RUSL,N,N
Y,RUTH,"Ruth's Hospitality Group, Inc. - Common Stock",Q,Q,N,100,N,N,,RUTH,N,N
Y,RVI,Retail Value Inc. Common Stock ,N, ,N,100,N,,RVI,RVI,N,N
Y,RVLV,"Revolve Group, Inc. Class A Common Stock",N, ,N,100,N,,RVLV,RVLV,N,N
Y,RVMD,"Revolution Medicines, Inc. - Common Stock",Q,Q,N,100,N,N,,RVMD,N,N
Y,RVNC,"Revance Therapeutics, Inc. - Common Stock",Q,G,N,100,N,N,,RVNC,N,N
Y,RVNU,Xtrackers Municipal Infrastructure Revenue Bond ETF,P, ,Y,100,N,,RVNU,RVNU,N,N
Y,RVP,"Retractable Technologies, Inc. Common Stock",A, ,N,100,N,,RVP,RVP,N,N
Y,RVRS,Reverse Cap Weighted US Large Cap ETF ,Z, ,Y,100,N,,RVRS,RVRS,N,N
Y,RVSB,Riverview Bancorp Inc - Common Stock,Q,Q,N,100,N,N,,RVSB,N,N
Y,RVT,"Royce Value Trust, Inc. Common Stock",N, ,N,100,N,,RVT,RVT,N,N
Y,RWGV,Direxion Russell 1000 Growth Over Value ETF,P, ,Y,100,N,,RWGV,RWGV,N,N
Y,RWJ,Invesco Exchange-Traded Fund Trust II Invesco S&P SmallCap 600 Revenue ETF,P, ,Y,100,N,,RWJ,RWJ,N,N
Y,RWK,Invesco Exchange-Traded Fund Trust II Invesco S&P MidCap 400 Revenue ETF,P, ,Y,100,N,,RWK,RWK,N,N
Y,RWL,Invesco Exchange-Traded Fund Trust II Invesco S&P 500 Revenue ETF,P, ,Y,100,N,,RWL,RWL,N,N
Y,RWLK,ReWalk Robotics Ltd. - Ordinary Shares,Q,S,N,100,N,N,,RWLK,N,N
Y,RWM,ProShares Short Russell2000,P, ,Y,100,N,,RWM,RWM,N,N
Y,RWO,SPDR DJ Wilshire Global Real Estate ETF,P, ,Y,100,N,,RWO,RWO,N,N
Y,RWR,SPDR DJ Wilshire REIT ETF,P, ,Y,100,N,,RWR,RWR,N,N
Y,RWT,"Redwood Trust, Inc. Common Stock",N, ,N,100,N,,RWT,RWT,N,N
Y,RWVG,Direxion Russell 1000 Value Over Growth ETF,P, ,Y,100,N,,RWVG,RWVG,N,N
Y,RWX,SPDR DJ Wilshire Intl Real Estate,P, ,Y,100,N,,RWX,RWX,N,N
Y,RXD,ProShares UltraShort Health Care,P, ,Y,100,N,,RXD,RXD,N,N
Y,RXI,iShares Global Consumer Discretionary ETF,P, ,Y,100,N,,RXI,RXI,N,N
Y,RXL,ProShares Ultra Health Care,P, ,Y,100,N,,RXL,RXL,N,N
Y,RXN,Rexnord Corporation Common Stock,N, ,N,100,N,,RXN,RXN,N,N
Y,RXT,"Rackspace Technology, Inc. - Common Stock",Q,Q,N,100,N,N,,RXT,N,N
Y,RY,Royal Bank Of Canada Common Stock,N, ,N,100,N,,RY,RY,N,N
Y,RY$T,"Royal Bank Of Canada 6.750% Fixed Rate/Floating Rate Noncumulative First Preferred Shares, Series C-2",N, ,N,100,N,,RYpT,RY-T,N,N
Y,RYAAY,"Ryanair Holdings plc - American Depositary Shares, each representing five Ordinary Shares",Q,Q,N,100,N,N,,RYAAY,N,N
Y,RYAM,Rayonier Advanced Materials Inc. Common Stock,N, ,N,100,N,,RYAM,RYAM,N,N
Y,RYB,"RYB Education, Inc. American depositary shares, each representing one Class A ordinary share",N, ,N,100,N,,RYB,RYB,N,N
Y,RYE,Invesco S&P 500 Equal Weight Energy ETF,P, ,Y,100,N,,RYE,RYE,N,N
Y,RYF,Invesco S&P 500 Equal Weight Financial ETF,P, ,Y,100,N,,RYF,RYF,N,N
Y,RYH,Invesco S&P 500 Equal Weight Health Care ETF,P, ,Y,100,N,,RYH,RYH,N,N
Y,RYI,Ryerson Holding Corporation Common Stock,N, ,N,100,N,,RYI,RYI,N,N
Y,RYJ,Invesco Raymond James SB-1 Equity ETF,P, ,Y,100,N,,RYJ,RYJ,N,N
Y,RYLD,Global X Russell 2000 Covered Call ETF,Z, ,Y,100,N,,RYLD,RYLD,N,N
Y,RYN,Rayonier Inc. REIT Common Stock,N, ,N,100,N,,RYN,RYN,N,N
Y,RYT,Invesco S&P 500 Equal Weight Technology ETF,P, ,Y,100,N,,RYT,RYT,N,N
Y,RYTM,"Rhythm Pharmaceuticals, Inc. - Common Stock",Q,G,N,100,N,N,,RYTM,N,N
Y,RYU,Invesco S&P 500 Equal Weight Utilities ETF,P, ,Y,100,N,,RYU,RYU,N,N
Y,RZA,"Reinsurance Group of America, Incorporated 6.20% Fixed-to-Floating Rate Subordinated Debentures due 2042",N, ,N,100,N,,RZA,RZA,N,N
Y,RZB,"Reinsurance Group of America, Incorporated 5.75% Fixed-To-Floating Rate Subordinated Debentures due 2056",N, ,N,100,N,,RZB,RZB,N,N
Y,RZG,Invesco S&P Smallcap 600 Pure Growth ETF,P, ,Y,100,N,,RZG,RZG,N,N
Y,RZV,Invesco S&P Smallcap 600 Pure Value ETF,P, ,Y,100,N,,RZV,RZV,N,N
Y,SA,"Seabridge Gold, Inc. Ordinary Shares (Canada)",N, ,N,100,N,,SA,SA,N,N
Y,SAA,ProShares Ultra SmallCap600,P, ,Y,100,N,,SAA,SAA,N,N
Y,SABR,Sabre Corporation - Common Stock,Q,Q,N,100,N,N,,SABR,N,N
Y,SABRP,Sabre Corporation - 6.50% Series A Mandatory Convertible Preferred Stock,Q,Q,N,100,N,N,,SABRP,N,N
Y,SACC,Sachem Capital Corp. 6.875% Notes due 2024,A, ,N,100,N,,SACC,SACC,N,N
Y,SACH,Sachem Capital Corp. Common Shares,A, ,N,100,N,,SACH,SACH,N,N
Y,SAF,Saratoga Investment Corp 6.25% Notes due 2023,N, ,N,100,N,,SAF,SAF,N,N
Y,SAFE,Safehold Inc. Common Stock,N, ,N,100,N,,SAFE,SAFE,N,N
Y,SAFM,"Sanderson Farms, Inc. - Common Stock",Q,Q,N,100,N,N,,SAFM,N,N
Y,SAFT,"Safety Insurance Group, Inc. - Common Stock",Q,Q,N,100,N,N,,SAFT,N,N
Y,SAGE,"Sage Therapeutics, Inc. - Common Stock",Q,G,N,100,N,N,,SAGE,N,N
Y,SAH,"Sonic Automotive, Inc. Common Stock",N, ,N,100,N,,SAH,SAH,N,N
Y,SAIA,"Saia, Inc. - Common Stock",Q,Q,N,100,N,N,,SAIA,N,N
Y,SAIC,SCIENCE APPLICATIONS INTERNATIONAL CORPORATION Common Stock,N, ,N,100,N,,SAIC,SAIC,N,N
Y,SAII,Software Acquisition Group Inc. II - Class A Common Stock,Q,S,N,100,N,N,,SAII,N,N
Y,SAIIU,Software Acquisition Group Inc. II - Unit,Q,S,N,100,N,N,,SAIIU,N,N
Y,SAIIW,Software Acquisition Group Inc. II - Warrant,Q,S,N,100,N,N,,SAIIW,N,N
Y,SAIL,"SailPoint Technologies Holdings, Inc. Common Stock",N, ,N,100,N,,SAIL,SAIL,N,N
Y,SAK,Saratoga Investment Corp 7.25% Notes due 2025,N, ,N,100,N,,SAK,SAK,N,N
Y,SAL,"Salisbury Bancorp, Inc. - Common Stock",Q,S,N,100,N,N,,SAL,N,N
Y,SALM,"Salem Media Group, Inc. - Class A Common Stock",Q,G,N,100,N,N,,SALM,N,N
Y,SALT,Scorpio Bulkers Inc. Common Stock,N, ,N,100,N,,SALT,SALT,N,N
Y,SAM,"Boston Beer Company, Inc. (The) Common Stock",N, ,N,100,N,,SAM,SAM,N,N
Y,SAMA,Schultze Special Purpose Acquisition Corp. - Common Stock,Q,S,N,100,N,N,,SAMA,N,N
Y,SAMAU,Schultze Special Purpose Acquisition Corp. - Unit,Q,S,N,100,N,N,,SAMAU,N,N
Y,SAMAW,Schultze Special Purpose Acquisition Corp. - Warrant,Q,S,N,100,N,N,,SAMAW,N,N
Y,SAMG,Silvercrest Asset Management Group Inc. - Common Stock,Q,G,N,100,N,N,,SAMG,N,N
Y,SAN,"Banco Santander, S.A. Sponsored ADR (Spain)",N, ,N,100,N,,SAN,SAN,N,N
Y,SAN$B,"Banco Santander, S.A. Floating Rate Non-cumulative Series 6 Guaranteed Preferred Securities",N, ,N,100,N,,SANpB,SAN-B,N,N
Y,SAND,Sandstorm Gold Ltd. Ordinary Shares (Canada),N, ,N,100,N,,SAND,SAND,N,N
Y,SANM,Sanmina Corporation - Common Stock,Q,Q,N,100,N,N,,SANM,N,N
Y,SANW,S&W Seed Company - Common Stock,Q,S,N,100,N,N,,SANW,N,N
Y,SAP,SAP  SE ADS,N, ,N,100,N,,SAP,SAP,N,N
Y,SAR,Saratoga Investment Corp New,N, ,N,100,N,,SAR,SAR,N,N
